{
  "$schema": "http://json-schema.org/draft-07/schema#",
  "title": "PROACTIVE Trace Log Entry",
  "type": "object",
  "required": ["claim_id", "timestamp", "claim_text", "confidence_score", "validator_results", "final_decision"],
  "properties": {
    "claim_id": {
      "type": "string",
      "description": "Unique identifier for the claim (UUID format)",
      "pattern": "^[a-f0-9]{8}-[a-f0-9]{4}-[a-f0-9]{4}-[a-f0-9]{4}-[a-f0-9]{12}$"
    },
    "timestamp": {
      "type": "string",
      "format": "date-time",
      "description": "ISO8601 datetime of claim generation"
    },
    "prompt_hash": {
      "type": "string",
      "description": "SHA256 hash of triggering prompt",
      "pattern": "^[a-f0-9]{64}$"
    },
    "claim_text": {
      "type": "string",
      "description": "The output claim text",
      "maxLength": 10000
    },
    "confidence_score": {
      "type": "number",
      "minimum": 0.0,
      "maximum": 1.0,
      "description": "Model confidence in the claim"
    },
    "epistemic_tag": {
      "type": "string",
      "enum": ["OBSERVED", "INFERRED", "SPECULATED"],
      "description": "I1 epistemic classification"
    },
    "evidence_sources": {
      "type": "array",
      "items": {
        "type": "string"
      },
      "description": "Array of evidence hashes or URIs"
    },
    "validator_results": {
      "type": "object",
      "required": ["I1_check", "I2_check", "I3_check", "I4_check", "I5_check", "I6_check"],
      "properties": {
        "I1_check": { "type": "string", "enum": ["PASS", "FAIL", "SKIP"] },
        "I2_check": { "type": "string", "enum": ["PASS", "FAIL", "SKIP"] },
        "I3_check": { "type": "string", "enum": ["PASS", "FAIL", "SKIP"] },
        "I4_check": { "type": "string", "enum": ["PASS", "FAIL", "SKIP"] },
        "I5_check": { "type": "string", "enum": ["PASS", "FAIL", "SKIP"] },
        "I6_check": { "type": "string", "enum": ["PASS", "FAIL", "SKIP"] }
      },
      "description": "Results of I1-I6 invariant checks"
    },
    "trace_chain": {
      "type": "object",
      "properties": {
        "REQ_id": { "type": "string" },
        "CTRL_id": { "type": "string" },
        "TEST_id": { "type": "string" },
        "EVID_id": { "type": "string" },
        "DECISION_id": { "type": "string" }
      },
      "description": "MBSE trace chain linkage"
    },
    "principle_tags": {
      "type": "array",
      "items": {
        "type": "string",
        "enum": ["P", "R", "O", "A", "C", "T", "I", "V", "E"]
      },
      "description": "Active PROACTIVE principles"
    },
    "failure_mode": {
      "type": ["string", "null"],
      "enum": ["F1", "F2", "F3", "F4", "F5", null],
      "description": "Detected failure mode (null if none)"
    },
    "final_decision": {
      "type": "string",
      "enum": ["EMIT", "BLOCK", "ESCALATE"],
      "description": "Final gate decision"
    }
  }
}
